frase,intencao
o que significa,pesquisa
o que quer dizer,pesquisa
o que é amor,pesquisa
o que é coronavirus,pesquisa
o que assistir,pesquisa
o que é verbo,pesquisa
o que a vida me roubou,pesquisa
o que é pandemia,pesquisa
o que é lockdown,pesquisa
o que é quarentena,pesquisa
o dia em que a terra parou,pesquisa
o que é pix,pesquisa
que horas começa o bbb,pesquisa
o que fazer em salvador,pesquisa
o que é cadastro unico,pesquisa
o que fazer em recife,pesquisa
o que é fascismo,pesquisa
resumo o que a vida me roubou,pesquisa
o que fazer em floripa,pesquisa
o que é saturação,pesquisa
o que significa quarentena,pesquisa
o que significa lockdown,pesquisa
o que é coriza,pesquisa
o que é borderline,pesquisa
que horas começa o bbb hoje,pesquisa
o que é coronavirus,pesquisa
o que é lockdown,pesquisa
o que é pix,pesquisa
o que é pandemia,pesquisa
o que é quarentena,pesquisa
o que significa lockdown,pesquisa
resumo o que a vida me roubou,pesquisa
o que significa quarentena,pesquisa
o dia em que a terra parou,pesquisa
o que é cadastro unico,pesquisa
conar o que é,pesquisa
o que a vida me roubou,pesquisa
como receber o dinheiro que o governo liberou,pesquisa
que horas começa o bbb hoje,pesquisa
que horas começa o bbb,pesquisa
o que fazer em floripa,pesquisa
brasilnopositivo.com.br o que é,pesquisa
o que é coriza,pesquisa
o que é borderline,pesquisa
o que fazer em salvador,pesquisa
o que é fascismo,pesquisa
o que fazer em recife,pesquisa
o que é saturação,pesquisa
o que é verbo,pesquisa
quem ganhou,pesquisa
quem sou eu,pesquisa
quem disse berenice,pesquisa
quem nunca,pesquisa
quem é você,pesquisa
bbb quem sai,pesquisa
revista quem,pesquisa
quem saiu do bbb,pesquisa
pis quem tem direito,pesquisa
quem sai do bbb,pesquisa
quem tem direito ao pis,pesquisa
quem joga hoje,pesquisa
quem sou eu para orkut,pesquisa
salve quem puder,pesquisa
quem ganhou a prova do lider,pesquisa
quem vai sair do bbb,pesquisa
quem ganhou o jogo,pesquisa
salve se quem puder,pesquisa
seguro desemprego quem tem direito,pesquisa
quem disse berenice,pesquisa
bbb quem sai,pesquisa
quem saiu do bbb,pesquisa
pis quem tem direito,pesquisa
quem sai do bbb,pesquisa
quem tem direito ao pis,pesquisa
quem joga hoje,pesquisa
quem sou eu para orkut,pesquisa
salve quem puder,pesquisa
quem ganhou a prova do lider,pesquisa
quem vai sair do bbb,pesquisa
quem ganhou o jogo,pesquisa
salve se quem puder,pesquisa
seguro desemprego quem tem direito,pesquisa
quem ganhou,pesquisa
quem é você,pesquisa
quem sou eu,pesquisa
quem nunca,pesquisa
quando começa o verão,pesquisa
quando a chuva passar,pesquisa
quando deus quer,pesquisa
quando estiver triste,pesquisa
quando eu chorar,pesquisa
de vez em quando,pesquisa
até quando,pesquisa
quando eu chorar,pesquisa
de vez em quando,pesquisa
quando começa o verão,pesquisa
quando a chuva passar,pesquisa
quando deus quer,pesquisa
quando estiver triste,pesquisa
onde comprar,pesquisa
onde fica,pesquisa
onde encontrar,pesquisa
onde está,pesquisa
onde aonde,pesquisa
por onde anda,pesquisa
onde estou,pesquisa
onde vai ser,pesquisa
onde hospedar,pesquisa
por onde andei,pesquisa
onde ou aonde,pesquisa
onde eu estou,pesquisa
onde o sol nasce,pesquisa
onde eu estou,pesquisa
onde o sol nasce,pesquisa
onde fica,pesquisa
onde vai ser,pesquisa
por onde anda,pesquisa
onde está,pesquisa
onde comprar,pesquisa
onde encontrar,pesquisa
como fazer,pesquisa
como faz,pesquisa
como chegar,pesquisa
como se escreve,pesquisa
como desenhar,pesquisa
como ganhar dinheiro,pesquisa
como emagrecer,pesquisa
como tirar print,pesquisa
como excluir facebook,pesquisa
como colocar musica no perfil do orkut,pesquisa
como baixar videos do youtube,pesquisa
como eu era antes de você,pesquisa
como baixar minecraft,pesquisa
como baixar video do youtube,pesquisa
como treinar seu dragão,pesquisa
como fazer um facebook,pesquisa
como fazer pudim,pesquisa
como excluir instagram,pesquisa
como fazer tapioca,pesquisa
como fazer um msn,pesquisa
como tirar print,pesquisa
como excluir facebook,pesquisa
como colocar musica no perfil do orkut,pesquisa
como baixar videos do youtube,pesquisa
como eu era antes de você,pesquisa
como baixar minecraft,pesquisa
como baixar video do youtube,pesquisa
como treinar seu dragão,pesquisa
como fazer um facebook,pesquisa
como fazer pudim,pesquisa
como excluir instagram,pesquisa
como fazer tapioca,pesquisa
como fazer um msn,pesquisa
como se escreve,pesquisa
como faz,pesquisa
quanto tempo,pesquisa
quanto custa,pesquisa
quanto tempo falta,pesquisa
quanto é o salario minimo,pesquisa
quanto custa um iphone,pesquisa
quanto tempo falta,pesquisa
quanto é o salario minimo,pesquisa
quanto custa um iphone,pesquisa
quanto tempo,pesquisa
quanto custa,pesquisa
"fale para Helena Neste sentido, a adoção de políticas descentralizadoras exige a precisão e a definição das condições inegavelmente apropriadas.",envio_mensagem
"diga para Alice Por conseguinte, a expansão dos mercados mundiais deve passar por modificações independentemente dos procedimentos normalmente adotados.",envio_mensagem
envie para Laura A prática cotidiana prova que o comprometimento entre as equipes desafia a capacidade de equalização das direções preferenciais no sentido do progresso.,envio_mensagem
"mande para Manuela O incentivo ao avanço tecnológico, assim como a consolidação das estruturas auxilia a preparação e a composição dos índices pretendidos.",envio_mensagem
"escreva para Valentina Do mesmo modo, a competitividade nas transações comerciais afeta positivamente a correta previsão das condições financeiras e administrativas exigidas.",envio_mensagem
fale para Sophia É claro que a execução dos pontos do programa representa uma abertura para a melhoria do levantamento das variáveis envolvidas.,envio_mensagem
diga para Isabella As experiências acumuladas demonstram que a revolução dos costumes faz parte de um processo de gerenciamento do sistema de participação geral.,envio_mensagem
"envie para Heloísa Acima de tudo, é fundamental ressaltar que o acompanhamento das preferências de consumo possibilita uma melhor visão global do impacto na agilidade decisória.",envio_mensagem
"mande para Luiza Todavia, o fenômeno da Internet nos obriga à análise dos paradigmas corporativos.",envio_mensagem
"escreva para Júlia No mundo atual, a necessidade de renovação processual exige a precisão e a definição do orçamento setorial.",envio_mensagem
"fale para Lorena Ainda assim, existem dúvidas a respeito de como a execução dos pontos do programa não pode mais se dissociar do sistema de participação geral.",envio_mensagem
"diga para Lívia Por outro lado, a percepção das dificuldades aponta para a melhoria dos modos de operação convencionais.",envio_mensagem
"envie para Maria Luiza Caros amigos, a complexidade dos estudos efetuados oferece uma interessante oportunidade para verificação do remanejamento dos quadros funcionais.",envio_mensagem
"mande para Cecília  Assim mesmo, o fenômeno da Internet é uma das consequências dos conhecimentos estratégicos para atingir a excelência.",envio_mensagem
escreva para Eloá  É importante questionar o quanto o entendimento das metas propostas pode nos levar a considerar a reestruturação das novas proposições.,envio_mensagem
fale para Giovanna  Podemos já vislumbrar o modo pelo qual o início da atividade geral de formação de atitudes assume importantes posições no estabelecimento de alternativas às soluções ortodoxas.,envio_mensagem
"diga para Maria Clara  Caros amigos, o desafiador cenário globalizado apresenta tendências no sentido de aprovar a manutenção dos modos de operação convencionais.",envio_mensagem
envie para Maria Eduarda  Gostaria de enfatizar que a contínua expansão de nossa atividade talvez venha a ressaltar a relatividade de todos os recursos funcionais envolvidos.,envio_mensagem
"mande para Mariana  A nível organizacional, o julgamento imparcial das eventualidades nos obriga à análise das diversas correntes de pensamento.",envio_mensagem
"escreva para Lara  Ainda assim, existem dúvidas a respeito de como a mobilidade dos capitais internacionais aponta para a melhoria do investimento em reciclagem técnica.",envio_mensagem
"fale para Beatriz  Do mesmo modo, a valorização de fatores subjetivos faz parte de um processo de gerenciamento das condições inegavelmente apropriadas.",envio_mensagem
"diga para Antonella  Nunca é demais lembrar o peso e o significado destes problemas, uma vez que a expansão dos mercados mundiais garante a contribuição de um grupo importante na determinação dos procedimentos normalmente adotados.",envio_mensagem
"envie para Maria Júlia  Evidentemente, a consulta aos diversos militantes pode nos levar a considerar a reestruturação de alternativas às soluções ortodoxas.",envio_mensagem
"mande para Emanuelly  Pensando mais a longo prazo, o aumento do diálogo entre os diferentes setores produtivos assume importantes posições no estabelecimento dos índices pretendidos.",envio_mensagem
"escreva para Isadora  Desta maneira, o desenvolvimento contínuo de distintas formas de atuação cumpre um papel essencial na formulação dos relacionamentos verticais entre as hierarquias.",envio_mensagem
fale para Miguel  É claro que a adoção de políticas descentralizadoras ainda não demonstrou convincentemente que vai participar na mudança do retorno esperado a longo prazo.,envio_mensagem
"diga para Arthur  Não obstante, a determinação clara de objetivos agrega valor ao estabelecimento dos níveis de motivação departamental.",envio_mensagem
envie para Davi  O cuidado em identificar pontos críticos na percepção das dificuldades garante a contribuição de um grupo importante na determinação da gestão inovadora da qual fazemos parte.,envio_mensagem
"mande para Gabriel  Todas estas questões, devidamente ponderadas, levantam dúvidas sobre se a valorização de fatores subjetivos cumpre um papel essencial na formulação do remanejamento dos quadros funcionais.",envio_mensagem
"escreva para Pedro  Nunca é demais lembrar o peso e o significado destes problemas, uma vez que a consulta aos diversos militantes causa impacto indireto na reavaliação dos relacionamentos verticais entre as hierarquias.",envio_mensagem
"fale para Matheus  Por outro lado, a complexidade dos estudos efetuados oferece uma interessante oportunidade para verificação do processo de comunicação como um todo.",envio_mensagem
diga para Lucas  A certificação de metodologias que nos auxiliam a lidar com o desenvolvimento contínuo de distintas formas de atuação estende o alcance e a importância das diretrizes de desenvolvimento para o futuro.,envio_mensagem
"envie para Nicolas  No entanto, não podemos esquecer que o novo modelo estrutural aqui preconizado acarreta um processo de reformulação e modernização das regras de conduta normativas.",envio_mensagem
"mande para Joaquim  Todas estas questões, devidamente ponderadas, levantam dúvidas sobre se o comprometimento entre as equipes é uma das consequências do processo de comunicação como um todo.",envio_mensagem
"escreva para Samuel  Neste sentido, o entendimento das metas propostas desafia a capacidade de equalização das novas proposições.",envio_mensagem
fale para Henrique  É importante questionar o quanto a determinação clara de objetivos afeta positivamente a correta previsão das direções preferenciais no sentido do progresso.,envio_mensagem
"diga para Rafael  O incentivo ao avanço tecnológico, assim como o julgamento imparcial das eventualidades estimula a padronização das regras de conduta normativas.",envio_mensagem
"envie para Guilherme  A nível organizacional, a competitividade nas transações comerciais maximiza as possibilidades por conta das condições financeiras e administrativas exigidas.",envio_mensagem
"mande para Murilo  Todavia, o consenso sobre a necessidade de qualificação facilita a criação do fluxo de informações.",envio_mensagem
"escreva para Gustavo  No mundo atual, a necessidade de renovação processual promove a alavancagem do orçamento setorial.",envio_mensagem
"fale para Isaac  Evidentemente, a constante divulgação das informações não pode mais se dissociar dos métodos utilizados na avaliação de resultados.",envio_mensagem
"diga para Felipe  Desta maneira, a crescente influência da mídia ainda não demonstrou convincentemente que vai participar na mudança do retorno esperado a longo prazo.",envio_mensagem
envie para Daniel  O empenho em analisar a estrutura atual da organização prepara-nos para enfrentar situações atípicas decorrentes das formas de ação.,envio_mensagem
"mande para Leonardo  Percebemos, cada vez mais, que a hegemonia do ambiente político maximiza as possibilidades por conta dos paradigmas corporativos.",envio_mensagem
"escreva para Eduardo  Não obstante, o início da atividade geral de formação de atitudes facilita a criação das diretrizes de desenvolvimento para o futuro.",envio_mensagem
fale para Antônio  O que temos que ter sempre em mente é que o desafiador cenário globalizado deve passar por modificações independentemente da gestão inovadora da qual fazemos parte.,envio_mensagem
"diga para Vitor  Assim mesmo, a crescente influência da mídia auxilia a preparação e a composição das formas de ação.",envio_mensagem
"envie para Caio  No entanto, não podemos esquecer que a hegemonia do ambiente político talvez venha a ressaltar a relatividade de todos os recursos funcionais envolvidos.",envio_mensagem
"mande para João  Pensando mais a longo prazo, o aumento do diálogo entre os diferentes setores produtivos estimula a padronização do sistema de formação de quadros que corresponde às necessidades.",envio_mensagem
escreva para Vinícius  O que temos que ter sempre em mente é que o surgimento do comércio virtual obstaculiza a apreciação da importância das posturas dos órgãos dirigentes com relação às suas atribuições.,envio_mensagem
quem falou comigo?,recebimento_mensagem
quais mensagens não li?,recebimento_mensagem
me diga quais são as novas mensagens,recebimento_mensagem
tenho algum recado não lido?,recebimento_mensagem
alguém me mandou uma mensagem?,recebimento_mensagem
me fale as mensagens que me enviaram,recebimento_mensagem
me diga quem falou comigo,recebimento_mensagem
me diga quem me mandou mensagens,recebimento_mensagem
fale quem me mandou mensagens,recebimento_mensagem
